{
  "spec": "authorized-retailers/0.4",
  "brand": {
    "name": "Example Brand",
    "domains": [
      "brand.example",
      "brand.co.uk"
    ]
  },
  "public": true,
  "issued": "2026-09-28T14:00:00Z",
  "valid_until": "2026-09-28T14:15:00Z",
  "stale_until": "2026-09-29T14:00:00Z",
  "authorizations": [
    {
      "id": "auth_01J9X2",
      "revocation_id": "rv_Q2l8dX4bT0aN5kPw",
      "retailer": {
        "name": "Example Retail LLC",
        "entity_id": "ent_7Q4M"
      },
      "channels": [
        {
          "type": "amazon",
          "domain": "amazon.com",
          "seller_id": "A1B2C3D4E5F6G7"
        },
        {
          "type": "walmart",
          "domain": "walmart.com",
          "seller_id": "101234567"
        },
        {
          "type": "web",
          "domain": "retailer.example"
        }
      ],
      "scope": {
        "territories": [
          "US"
        ],
        "product_lines": [
          "Classic Tee"
        ]
      },
      "proposed_by": null
    }
  ],
  "signature": {
    "kid": "ar-20260928-6e37",
    "jws": "eyJhbGciOiJFZERTQSIsImtpZCI6ImFyLTIwMjYwOTI4LTZlMzcifQ..c2lnbmF0dXJlLXBsYWNlaG9sZGVy"
  },
  "catalog": [
    {
      "id": "EB-TEE-BLK-M",
      "name": "Classic Tee, Black, M",
      "product_line": "Classic Tee",
      "attributes": {
        "color": "Black",
        "size": "M"
      },
      "walmart_item_ids": [
        "123456789"
      ],
      "wpids": [
        "1A2B3C4D5E6F"
      ],
      "mpns": [
        "EB-100-BLK"
      ],
      "style_code": "EB-TEE"
    },
    {
      "id": "EB-TEE-WHT-M",
      "name": "Classic Tee, White, M",
      "product_line": "Classic Tee",
      "gtin": "4006381333931",
      "asins": [
        "B0EXAMPLE2"
      ]
    },
    {
      "id": "EB-RUN-V2",
      "name": "Runner V2",
      "product_line": "Running",
      "gtin": "96385074"
    },
    {
      "id": "EB-RUN-V3",
      "name": "Runner V3",
      "product_line": "Running",
      "asins": [
        "B0EXAMPLE3"
      ]
    },
    {
      "id": "EB-DTC-1",
      "name": "Founders Edition",
      "product_line": "Limited",
      "gtin": "12345678901231"
    },
    {
      "id": "EB-TEE-US",
      "name": "Classic Tee, US formula dye",
      "product_line": "Classic Tee",
      "gtin": "012345678912",
      "regions": [
        "US"
      ]
    },
    {
      "id": "EB-TEE-EU",
      "name": "Classic Tee, EU formula dye",
      "product_line": "Classic Tee",
      "gtin": "4012345678901",
      "regions": [
        "EU"
      ]
    },
    {
      "id": "EB-TEE-OLD",
      "name": "Classic Tee, 2019 dye",
      "product_line": "Classic Tee",
      "gtin": "012345678929",
      "status": "recalled",
      "status_since": "2026-09-01",
      "recall_url": "https://www.cpsc.gov/Recalls/2026/example"
    }
  ],
  "exclusions": {
    "products": [
      "EB-DTC-1"
    ]
  }
}
